{"captureDiagnostics":{"correlationErrorCount":0,"droppedPackets":0},"events":[{"assertion":null,"causalId":"CAUSE-9cc2c11531934001a38f6206eeb09809","evidence":{"beforeCapture":{"height":602,"id":"CAP-6d8e1682a847486b988dde6455b0ea0e","origin":[19,-37],"redacted":true,"redactions":[],"sha256":"sha256:59d96e4668c5400b59d17d17c86f6a2a258bb7fb1f74762d8e6f7b10202b4055","width":922},"capture":{"height":602,"id":"CAP-0b8202cf0f414e02b4ba867c55e7c272","origin":[105,107],"redacted":true,"redactions":[[522,101,788,238]],"sha256":"sha256:c29574fea92978e4daaa837c32f618b55888f68839c52e760fe4d973c50a6b7c","width":922},"doubleClickIntervalMs":500,"foregroundPid":5948},"input":{"button":"left","clickCount":1,"screenPoint":[599,321]},"monotonicMs":486992171,"observedTarget":{"ancestry":[{"automationId":"EdrMainWindow.baseWidget.pageWidget.mainPage","controlType":"Group"},{"automationId":"EdrMainWindow.baseWidget.pageWidget","controlType":"Custom"},{"automationId":"EdrMainWindow.baseWidget","controlType":"Group"},{"automationId":"EdrMainWindow","controlType":"Window","name":"logo1"},{"controlType":"Pane","name":"Desktop 1"}],"automationId":"EdrMainWindow.baseWidget.pageWidget.mainPage.contentWidget","controlType":"Group","fingerprint":"sha256:39d8e0c851fc03df5e0632c897c864d70fb6ba450562d32e95f4390954a366cd","identifier":null,"protected":false,"rect":[106,272,1026,656],"snapshotId":"OBS-6a0303efc4b54df2b21d6c041434ee8b","targetId":"T0001","text":""},"scope":{"backend":"windows_pywinauto","processName":"EDRClient.exe","target":"target","windowTitle":"^logo1$"},"sequence":1,"type":"pointer_click","wallTime":"2026-08-18T02:18:51.103Z"},{"assertion":null,"causalId":"CAUSE-39eaf28c78f54e4ba6eaf4ca714b2ee9","evidence":{"beforeCapture":{"height":602,"id":"CAP-0b8202cf0f414e02b4ba867c55e7c272","origin":[105,107],"redacted":true,"redactions":[[522,101,788,238]],"sha256":"sha256:c29574fea92978e4daaa837c32f618b55888f68839c52e760fe4d973c50a6b7c","width":922},"capture":{"height":602,"id":"CAP-d1581e27eb5042aeaeeb20a1080bc6bd","origin":[105,107],"redacted":true,"redactions":[[755,276,922,413]],"sha256":"sha256:0e47b3e56bb8543ec4a2e157ddb298f18cb85a4ec8620c85415816adaf7506fd","width":922},"doubleClickIntervalMs":500,"foregroundPid":5948},"input":{"button":"left","clickCount":1,"screenPoint":[214,555]},"monotonicMs":486998328,"observedTarget":{"ancestry":[{"automationId":"EdrMainWindow.baseWidget.pageWidget.mainPage.contentWidget.mainWidget.operationWidget","controlType":"Group"},{"automationId":"EdrMainWindow.baseWidget.pageWidget.mainPage.contentWidget.mainWidget","controlType":"Group"},{"automationId":"EdrMainWindow.baseWidget.pageWidget.mainPage.contentWidget","controlType":"Group"},{"automationId":"EdrMainWindow.baseWidget.pageWidget.mainPage","controlType":"Group"},{"automationId":"EdrMainWindow.baseWidget.pageWidget","controlType":"Custom"},{"automationId":"EdrMainWindow.baseWidget","controlType":"Group"}],"automationId":"EdrMainWindow.baseWidget.pageWidget.mainPage.contentWidget.mainWidget.operationWidget.logCenterBtn","controlType":"Button","fingerprint":"sha256:be58802a43a112b38422af7a12afbb3be41484295cb553f26cb09aeae009691e","identifier":null,"protected":false,"rect":[156,509,261,607],"snapshotId":"OBS-41a71f520fa043b6904efbe7d02c078a","targetId":"T0001","text":"日志中心"},"scope":{"backend":"windows_pywinauto","processName":"EDRClient.exe","target":"target","windowTitle":"^logo1$"},"sequence":2,"type":"pointer_click","wallTime":"2026-08-18T02:18:57.259Z"},{"assertion":null,"causalId":"CAUSE-39eaf28c78f54e4ba6eaf4ca714b2ee9","evidence":{"foregroundPid":5948},"input":{"kind":"opened","processName":"EDRClient.exe","timeoutSeconds":5.0,"title":"日志中心"},"monotonicMs":486998515,"observedTarget":null,"scope":{"backend":"windows_pywinauto","processName":"EDRClient.exe","target":"target","windowTitle":"^logo1$"},"sequence":3,"type":"window_transition","wallTime":"2026-08-18T02:18:57.447Z"},{"assertion":null,"causalId":"CAUSE-39eaf28c78f54e4ba6eaf4ca714b2ee9","evidence":{"foregroundPid":5948},"input":{"kind":"opened","processName":"EDRClient.exe","timeoutSeconds":6.2,"title":"EDRClient"},"monotonicMs":487000406,"observedTarget":null,"scope":{"backend":"windows_pywinauto","processName":"EDRClient.exe","target":"target","windowTitle":"^logo1$"},"sequence":4,"type":"window_transition","wallTime":"2026-08-18T02:18:59.334Z"},{"assertion":null,"causalId":"CAUSE-39eaf28c78f54e4ba6eaf4ca714b2ee9","evidence":{"foregroundPid":5948},"input":{"kind":"opened","processName":"EDRClient.exe","timeoutSeconds":6.2},"monotonicMs":487000406,"observedTarget":null,"scope":{"backend":"windows_pywinauto","processName":"EDRClient.exe","target":"target","windowTitle":"^logo1$"},"sequence":5,"type":"window_transition","wallTime":"2026-08-18T02:18:59.334Z"},{"assertion":null,"causalId":"CAUSE-39eaf28c78f54e4ba6eaf4ca714b2ee9","evidence":{"foregroundPid":null},"input":{"kind":"closed","processName":"EDRClient.exe","timeoutSeconds":7.7,"title":"EDRClient"},"monotonicMs":487000906,"observedTarget":null,"scope":{"backend":"windows_pywinauto","processName":"EDRClient.exe","target":"target","windowTitle":"^logo1$"},"sequence":6,"type":"window_transition","wallTime":"2026-08-18T02:18:59.834Z"},{"assertion":null,"causalId":"CAUSE-39eaf28c78f54e4ba6eaf4ca714b2ee9","evidence":{"foregroundPid":null},"input":{"kind":"closed","processName":"EDRClient.exe","timeoutSeconds":7.7},"monotonicMs":487000906,"observedTarget":null,"scope":{"backend":"windows_pywinauto","processName":"EDRClient.exe","target":"target","windowTitle":"^logo1$"},"sequence":7,"type":"window_transition","wallTime":"2026-08-18T02:18:59.834Z"}],"name":"hisec-logcenter","schema":"edr.desktop-recording/v1","sessionId":"REC-0964d44dd9d345b8925a36b84e3b6671"}
